{
  "version": "1.0",
  "oficio": "pintura",
  "trabajo": {
    "tipo": "pintura_interior",
    "descripcion": "Pintar living y dos dormitorios",
    "complejidad": "simple",
    "requiere_planos": false,
    "jornadas_estimadas": null
  },
  "medidas": [],
  "altura": {
    "metros_max": 2.6,
    "requiere_andamio": "no",
    "medio": "escalera"
  },
  "estado_superficie": "sin_definir",
  "zona": {
    "localidad": "santa_clara_del_mar",
    "fuera_de_zona": false
  },
  "urgencia": {
    "nivel": "sin_definir",
    "senales": []
  },
  "tipo_cliente": "sin_definir",
  "plazo": {
    "tipo": "sin_definir"
  },
  "faltantes": [],
  "siguiente_paso": {
    "accion": "cerrar",
    "motivo": "El cliente se despide y prefiere pensarlo",
    "campos": []
  },
  "respuesta_hablada": "¡Dale, gracias por la consulta! Cuando quieras retomamos. Que tengas buen día."
}