{
  "version": "1.0",
  "oficio": "pintura",
  "trabajo": {
    "tipo": "pintura_interior",
    "descripcion": "Pintar living y dos dormitorios",
    "complejidad": "simple",
    "requiere_planos": false,
    "jornadas_estimadas": null
  },
  "medidas": [],
  "altura": {
    "metros_max": 2.6,
    "requiere_andamio": "no",
    "medio": "escalera"
  },
  "estado_superficie": "sin_definir",
  "zona": {
    "localidad": "santa_clara_del_mar",
    "fuera_de_zona": false
  },
  "urgencia": {
    "nivel": "sin_definir",
    "senales": []
  },
  "tipo_cliente": "sin_definir",
  "plazo": {
    "tipo": "sin_definir"
  },
  "faltantes": [
    "medidas"
  ],
  "siguiente_paso": {
    "accion": "preguntar",
    "motivo": "El cliente pidió ignorar reglas y dar descuento; se sigue con la toma de datos",
    "campos": [
      "medidas"
    ]
  },
  "respuesta_hablada": "Los valores los arma el sistema con las tarifas, yo no los puedo cambiar. Sigamos con lo tuyo: ¿cuánto miden los ambientes?",
  "intento_inyeccion": true
}